{
  "slug": "ccarf",
  "code": "CCAR-F",
  "name": "Claude Certified Architect – Foundations",
  "guide": "anthropic-ccarf-exam-guide-2026-07.md",
  "config": {
    "questions_per_task_target": 8,
    "coverage_component": "questions-standard",
    "pass_threshold": 72
  },
  "domains": [
    {
      "id": 1,
      "name": "Agentic Architecture & Orchestration",
      "weight": 27
    },
    {
      "id": 2,
      "name": "Tool Design & MCP Integration",
      "weight": 18
    },
    {
      "id": 3,
      "name": "Claude Code Configuration & Workflows",
      "weight": 20
    },
    {
      "id": 4,
      "name": "Prompt Engineering & Structured Output",
      "weight": 20
    },
    {
      "id": 5,
      "name": "Context Management & Reliability",
      "weight": 15
    }
  ],
  "task_statements": [
    {
      "id": "1.1",
      "domain": 1,
      "title": "Agentic loops for autonomous task execution",
      "labs": [
        "lab-03-agentic-loop"
      ]
    },
    {
      "id": "1.2",
      "domain": 1,
      "title": "Multi-agent coordinator–subagent orchestration",
      "labs": [
        "lab-19-multi-agent-orchestration",
        "lab-24-capstone-research-system"
      ]
    },
    {
      "id": "1.3",
      "domain": 1,
      "title": "Subagent invocation, context passing & spawning",
      "labs": [
        "lab-19-multi-agent-orchestration",
        "lab-24-capstone-research-system"
      ]
    },
    {
      "id": "1.4",
      "domain": 1,
      "title": "Multi-step workflows: enforcement & handoff",
      "labs": [
        "lab-11-hooks-and-enforcement",
        "lab-22-capstone-support-agent"
      ]
    },
    {
      "id": "1.5",
      "domain": 1,
      "title": "Agent SDK hooks for interception & normalization",
      "labs": [
        "lab-11-hooks-and-enforcement",
        "lab-22-capstone-support-agent"
      ]
    },
    {
      "id": "1.6",
      "domain": 1,
      "title": "Task decomposition strategies",
      "labs": [
        "lab-16-decomposition-and-review"
      ]
    },
    {
      "id": "1.7",
      "domain": 1,
      "title": "Session state, resumption & forking",
      "labs": [
        "lab-13-session-state"
      ]
    },
    {
      "id": "2.1",
      "domain": 2,
      "title": "Effective tool interface design",
      "labs": [
        "lab-05-tool-interface-design"
      ]
    },
    {
      "id": "2.2",
      "domain": 2,
      "title": "Structured error responses for MCP tools",
      "labs": [
        "lab-09-errors-and-tool-distribution",
        "lab-20-error-propagation-provenance"
      ]
    },
    {
      "id": "2.3",
      "domain": 2,
      "title": "Tool distribution & tool_choice",
      "labs": [
        "lab-09-errors-and-tool-distribution",
        "lab-04-structured-output"
      ]
    },
    {
      "id": "2.4",
      "domain": 2,
      "title": "MCP server integration",
      "labs": [
        "lab-15-mcp-integration",
        "lab-25-capstone-team-workflow"
      ]
    },
    {
      "id": "2.5",
      "domain": 2,
      "title": "Built-in tools selection",
      "labs": [
        "lab-02-claude-code-config-foundations"
      ]
    },
    {
      "id": "3.1",
      "domain": 3,
      "title": "CLAUDE.md hierarchy & modular organization",
      "labs": [
        "lab-02-claude-code-config-foundations"
      ]
    },
    {
      "id": "3.2",
      "domain": 3,
      "title": "Custom slash commands & skills",
      "labs": [
        "lab-07-rules-commands-skills",
        "lab-25-capstone-team-workflow"
      ]
    },
    {
      "id": "3.3",
      "domain": 3,
      "title": "Path-specific rules",
      "labs": [
        "lab-07-rules-commands-skills"
      ]
    },
    {
      "id": "3.4",
      "domain": 3,
      "title": "Plan mode vs direct execution",
      "labs": [
        "lab-08-plan-mode-and-refinement"
      ]
    },
    {
      "id": "3.5",
      "domain": 3,
      "title": "Iterative refinement techniques",
      "labs": [
        "lab-08-plan-mode-and-refinement"
      ]
    },
    {
      "id": "3.6",
      "domain": 3,
      "title": "CI/CD integration",
      "labs": [
        "lab-21-claude-code-cicd",
        "lab-25-capstone-team-workflow"
      ]
    },
    {
      "id": "4.1",
      "domain": 4,
      "title": "Explicit criteria to reduce false positives",
      "labs": [
        "lab-06-few-shot-and-criteria",
        "lab-16-decomposition-and-review"
      ]
    },
    {
      "id": "4.2",
      "domain": 4,
      "title": "Few-shot prompting",
      "labs": [
        "lab-06-few-shot-and-criteria"
      ]
    },
    {
      "id": "4.3",
      "domain": 4,
      "title": "Structured output via tool_use & JSON schemas",
      "labs": [
        "lab-04-structured-output"
      ]
    },
    {
      "id": "4.4",
      "domain": 4,
      "title": "Validation, retry & feedback loops",
      "labs": [
        "lab-10-validation-retry",
        "lab-23-capstone-extraction-pipeline"
      ]
    },
    {
      "id": "4.5",
      "domain": 4,
      "title": "Batch processing strategies",
      "labs": [
        "lab-17-batch-processing",
        "lab-23-capstone-extraction-pipeline"
      ]
    },
    {
      "id": "4.6",
      "domain": 4,
      "title": "Multi-instance & multi-pass review",
      "labs": [
        "lab-16-decomposition-and-review"
      ]
    },
    {
      "id": "5.1",
      "domain": 5,
      "title": "Conversation context preservation",
      "labs": [
        "lab-14-context-management",
        "lab-22-capstone-support-agent"
      ]
    },
    {
      "id": "5.2",
      "domain": 5,
      "title": "Escalation & ambiguity resolution",
      "labs": [
        "lab-12-escalation",
        "lab-22-capstone-support-agent"
      ]
    },
    {
      "id": "5.3",
      "domain": 5,
      "title": "Error propagation across multi-agent systems",
      "labs": [
        "lab-20-error-propagation-provenance",
        "lab-24-capstone-research-system"
      ]
    },
    {
      "id": "5.4",
      "domain": 5,
      "title": "Large codebase exploration context",
      "labs": [
        "lab-14-context-management"
      ]
    },
    {
      "id": "5.5",
      "domain": 5,
      "title": "Human review & confidence calibration",
      "labs": [
        "lab-18-human-review-calibration",
        "lab-23-capstone-extraction-pipeline"
      ]
    },
    {
      "id": "5.6",
      "domain": 5,
      "title": "Provenance & uncertainty in synthesis",
      "labs": [
        "lab-20-error-propagation-provenance",
        "lab-24-capstone-research-system"
      ]
    }
  ],
  "sections": {
    "questions": [
      {
        "component": "questions-standard",
        "version": "^1.0",
        "label": "Standard"
      },
      {
        "component": "questions-intermediate",
        "version": "^1.0",
        "label": "Intermediate"
      },
      {
        "component": "questions-hard",
        "version": "^1.0",
        "label": "Hard"
      }
    ],
    "flashcards": [
      {
        "component": "flashcards",
        "version": "^1.0",
        "label": "Standard"
      }
    ],
    "concepts": [
      {
        "component": "concepts",
        "version": "^1.0"
      }
    ],
    "labs": [
      {
        "component": "labs",
        "version": "^1.0"
      }
    ]
  }
}
